{
  "id": "WF-009",
  "name": "Agent build",
  "family": "runtime",
  "intent": "Add or change a runtime agent — one of the Jido agents behind the agent port — with its permissions, memory and failure behaviour decided rather than inherited.",
  "trigger": { "kinds": ["feature"], "keywords": ["jido", "jido agent", "runtime agent", "agent runtime", "oracle", "echo voice", "onlooker companion", "tool use"], "risk": "medium",
    "note": "The bare keyword `agent` was removed. This workflow's intent says \"one of the Jido agents behind the agent port\", and in this repository the commoner sense of the word is the other one: `.agents/` is a registry of 270 coding roles and every harness bead says `agent` several times. \"Dependency-authored agent instructions\" routed here, to a workflow about runtime agents with permissions and memory. Verified before and after against `Add a new agent for the agent gateway` and `Add an agent that narrates transitions`, which route here either way." },
  "artifacts": { "in": ["Requirement"], "out": ["AgentSpec", "CodePatch", "EvaluationRun"] },
  "default_lane": "focused",
  "retry_budget": 3,
  "steps": [
    { "id": "spec", "name": "AgentSpec: purpose, inputs, outputs, forbidden actions, escalation", "capabilities": ["runtime.agents", "architecture.domain"], "inputs": ["requirement", "adr_005"], "outputs": ["AgentSpec"], "trust": "T1" },
    { "id": "port", "name": "Does it fit behind the agent port, or does the port change", "capabilities": ["architecture.api"], "inputs": ["AgentSpec"], "outputs": ["port verdict"], "trust": "T1", "note": "a design decision puts Jido behind a port precisely so the domain does not learn about Jido. A port change is an ADR." },
    { "id": "context", "name": "What context it gets, and what it must not see", "capabilities": ["runtime.context"], "inputs": ["AgentSpec"], "outputs": ["context contract"], "trust": "T1" },
    { "id": "permissions", "name": "Tools and trust level", "capabilities": ["runtime.tools"], "inputs": ["AgentSpec"], "outputs": ["permission set"], "trust": "T1" },
    { "id": "memory", "name": "What it remembers and for how long", "capabilities": ["runtime.memory"], "inputs": ["AgentSpec"], "outputs": ["memory policy"], "trust": "T1" },
    { "id": "implement", "name": "Implement under supervision, with stated failure semantics", "capabilities": ["runtime.agents", "elixir.otp"], "inputs": ["AgentSpec", "context contract", "permission set"], "outputs": ["CodePatch"], "trust": "T2", "gates": ["format", "compile"] },
    { "id": "sandbox", "name": "Run it in a sandbox against its failure suite", "capabilities": ["evolution.evaluation", "qa.testing"], "inputs": ["CodePatch"], "outputs": ["EvaluationRun"], "trust": "T2", "gates": ["test.touched"] },
    { "id": "benchmark", "name": "Baseline it before it becomes the default", "capabilities": ["evolution.evaluation"], "inputs": ["EvaluationRun"], "outputs": ["Benchmark"], "trust": "T2", "optional": true }
  ],
  "escalations": [
    { "when": "the agent would need a tool above its trust level", "to": "security.mcp_security_auditor" },
    { "when": "the agent port would have to change", "to": "WF-001" }
  ],
  "completion": ["AgentSpec complete including forbidden actions", "supervision and restart behaviour tested", "failure suite run"],
  "memory": ["failure modes found in the sandbox"],
  "evaluation": ["production failure rate against the sandbox suite"]
}
