{
  "artifacts": {
    "in": [
      "Requirement"
    ],
    "out": [
      "ResearchNote",
      "RFC",
      "ADR",
      "TaskGraph"
    ]
  },
  "completion": [
    "at least two variants with what each forecloses",
    "an ADR recording the human decision",
    "a task graph, or an explicit decision to do nothing"
  ],
  "default_lane": "fast",
  "escalations": [
    {
      "note": "Agents execute and critique. They do not redefine the project.",
      "to": "human_architect",
      "when": "any step produces a recommendation rather than options"
    }
  ],
  "evaluation": [
    "did the strategy survive contact with the next quarter's evidence"
  ],
  "family": "governance",
  "id": "WF-018",
  "intent": "Change how the project itself is organised — direction, priorities, capability — as a decision with evidence rather than a mood.",
  "memory": [
    "the decision and the option it closed"
  ],
  "name": "Organization evolution",
  "retry_budget": 2,
  "steps": [
    {
      "capabilities": [
        "governance.planning",
        "research.prior_art"
      ],
      "id": "state",
      "inputs": [
        "beads",
        "git_history",
        "memory",
        "changelog"
      ],
      "name": "Where the project actually is",
      "note": "Evidence, not the roadmap's opinion of itself.",
      "outputs": [
        "state of the project"
      ],
      "trust": "T0"
    },
    {
      "capabilities": [
        "governance.planning"
      ],
      "id": "goal",
      "inputs": [
        "state of the project"
      ],
      "name": "The goal, stated so a failure is recognisable",
      "outputs": [
        "goal statement"
      ],
      "trust": "T1"
    },
    {
      "capabilities": [
        "governance.risk"
      ],
      "id": "variants",
      "inputs": [
        "state of the project",
        "goal statement"
      ],
      "name": "Strategy variants with their costs and what each forecloses",
      "outputs": [
        "variants"
      ],
      "trust": "T1"
    },
    {
      "capabilities": [
        "governance.decision_record"
      ],
      "gates": [
        "human.approval"
      ],
      "id": "decide",
      "inputs": [
        "variants"
      ],
      "name": "Human decision",
      "note": "Direction is the human architect's. This workflow prepares the decision; it does not make it.",
      "outputs": [
        "ADR"
      ],
      "trust": "T2"
    },
    {
      "capabilities": [
        "governance.planning"
      ],
      "id": "plan",
      "inputs": [
        "ADR"
      ],
      "name": "Turn the decision into a work graph",
      "outputs": [
        "TaskGraph"
      ],
      "trust": "T1"
    },
    {
      "capabilities": [
        "runtime.memory"
      ],
      "id": "learn",
      "inputs": [
        "ADR"
      ],
      "name": "Record what the organisation learned",
      "outputs": [
        "memory record"
      ],
      "trust": "T1"
    }
  ],
  "trigger": {
    "keywords": [
      "strategy",
      "priorities",
      "roadmap",
      "organisation",
      "direction",
      "what should we build"
    ],
    "kinds": [
      "governance",
      "strategy"
    ],
    "risk": "high"
  }
}
